{
  "schema_version": 1,
  "client": "Acme Demo Corp",
  "slug": "acme-demo-corp",
  "generated_at": "2026-07-23T10:35:00Z",
  "sources": {
    "stack_research": {
      "schema_version": 1,
      "skill": "stack-research",
      "client": "Acme Demo Corp",
      "slug": "acme-demo-corp",
      "created_at": "2026-07-23T10:00:00Z",
      "updated_at": "2026-07-23T10:14:00Z",
      "focus": { "roles": ["backend"], "countries": [] },
      "boards": [
        {
          "id": "linkedin-jobs",
          "name": "LinkedIn Jobs",
          "status": "done",
          "postings_found": 2,
          "stack_signals": ["Python", "AWS", "PostgreSQL"],
          "posting_urls": [
            {
              "url": "https://example.com/linkedin/jobs/acme-backend-engineer",
              "source_type": "job-board",
              "access_date": "2026-07-23",
              "publish_date": "2026-07-18"
            }
          ],
          "checked_at": "2026-07-23T10:05:00Z",
          "error": null
        }
      ],
      "aggregate_stack": {
        "languages": ["Python"],
        "frameworks": [],
        "cloud_infra": ["AWS"],
        "data": ["PostgreSQL"],
        "other": []
      }
    },
    "vendor_research": {
      "schema_version": 1,
      "skill": "vendor-research",
      "client": "Acme Demo Corp",
      "slug": "acme-demo-corp",
      "created_at": "2026-07-23T10:15:00Z",
      "updated_at": "2026-07-23T10:22:00Z",
      "items": [
        {
          "id": "client-site-1",
          "label": "Sitio del cliente",
          "status": "done",
          "findings": ["Amazon Web Services"],
          "source_urls": [
            {
              "url": "https://example.com/acme/partners",
              "source_type": "client-site",
              "access_date": "2026-07-23",
              "publish_date": null
            }
          ],
          "checked_at": "2026-07-23T10:18:00Z",
          "error": null
        }
      ],
      "aggregate": {
        "vendors": [
          {
            "name": "Amazon Web Services",
            "mentions": 1,
            "source_types": ["client-site"],
            "source_urls": ["https://example.com/acme/partners"]
          }
        ]
      }
    },
    "competitor_research": {
      "schema_version": 1,
      "skill": "competitor-research",
      "client": "Acme Demo Corp",
      "slug": "acme-demo-corp",
      "created_at": "2026-07-23T10:25:00Z",
      "updated_at": "2026-07-23T10:31:00Z",
      "items": [
        {
          "id": "demo-competitor-agency",
          "label": "Demo Competitor Agency",
          "status": "done",
          "findings": ["portfolio"],
          "source_urls": [
            {
              "url": "https://example.com/demo-competitor-agency/work/acme-demo-corp",
              "source_type": "directory",
              "access_date": "2026-07-23",
              "publish_date": "2026-05-01"
            }
          ],
          "checked_at": "2026-07-23T10:29:00Z",
          "error": null
        }
      ],
      "aggregate": {
        "competitors_with_evidence": [
          {
            "name": "Demo Competitor Agency",
            "mentions": 1,
            "source_types": ["directory"],
            "source_urls": ["https://example.com/demo-competitor-agency/work/acme-demo-corp"]
          }
        ]
      }
    }
  },
  "cross_references": [
    {
      "name": "Amazon Web Services",
      "appears_in": ["stack-research", "vendor-research"],
      "detail": "AWS aparece como stack_signal en LinkedIn Jobs y como proveedor listado en el sitio del cliente -- dos fuentes independientes corroborando lo mismo."
    }
  ],
  "verification_summary": {
    "total_sources": 3,
    "source_types_breakdown": {
      "job-board": 1,
      "client-site": 1,
      "directory": 1
    }
  }
}
